Video ID,Comment,Toxicity,Type,target
NWsNVfHsuF0,"اتوقع ان نسخة خليجي  سعودية 

منتخب كوت ديفوار هو اخر منتخب تأهل في أخر نسخة لأمم أفريقيا وفاز باللقب",0,,
qej8hvq2lZo,"في بداية الموسم 
 أكل خماسية
 أكل سباعية 
 أكل رباعية
 تعادلين سلبيين
 خسر من ايفرتون
 أكل سداسية
زيدان اول مبارة تعادل سلبي
الاعلام والجمهور المحنك وبيدرول   يدمر   أداء الريال لا يعجبني وزيدان يتخبط",0,,
qej8hvq2lZo,من الدقيقة  الى الدقيقة  فرحه وبلنتي وغيرنا وغيرنا ومن الدقيقة  صياح وبكى وغبنه وضغط عزيزي جلوري انها اقصر قصه حزن شهدها التاريخ هاردلك حبيبي,0,,
qej8hvq2lZo,القم اخي تذكر يوم انك ضحكت علينا نحن البرشا يوم ما خسرنا بي  القم رغم انك تعجبني لكن الصراحة ابلع شيخ,1,1,1
qej8hvq2lZo,وارنولد يقطع بصل,1,1,1
qej8hvq2lZo,مايدري ليفربول خسرانين ٧,0,,
qej8hvq2lZo,الاتحاد اقوى من اليونايتد,0,,
NWsNVfHsuF0,الف ترليون مبروك للسعودية الحبيبة,0,,
qej8hvq2lZo,ابلع حتة بعد متحجي ع برشة,1,1,1
qej8hvq2lZo,سعاادهه غارمهه تووكك توكك باريسس بيشقك بعد مع اني احترم تاريخ مانشستر بس عشانك ابيهم يبلعون,0,,
u8Y9W0rFGZU,كافر البحرين، أنتم شعب يكرهه النبي، أنتم منافقون، أنتم غير صادقين، أيها اللاعبون  القادة  كلكم منخرطون لن يقبلوا الجنة التي وعد الله بها والنبي محمد يخرجون كافر كافر,1,2,4
qej8hvq2lZo,القم ه,1,1,1
u8Y9W0rFGZU,نباحك طرب,1,1,1
qej8hvq2lZo,اللي حسب المايك ديد جلوري لا يحط لايك,1,1,1
qej8hvq2lZo,بس افرح ليفربول اكلوها بسباعيه,0,,
NWsNVfHsuF0,عفية عليكم رجال قول وفعل وكنتوا رجال داخل الملعب واعطيتوهم درس بكرة القدم إنها تلعب داخل الملعب وليس خارجها  ألف ألف مبروك تستاهلون  محبكم من الأردن,0,,
qej8hvq2lZo,برشلونة فاتح للتشجيع,0,,
qej8hvq2lZo,ألقوم بس لا تحكي عن,1,1,1
qej8hvq2lZo,ابلع تتمسخر ع االبرشا ونتو بلعتو من فريق زبال،,1,2,1
u8Y9W0rFGZU,حبيبي النعيمي ماف حاجة اسمها حظ وشعوزة دا اسمو جودة لعيبة ريال مدريد والفنش العندهم عالي جدا والاستحواذ والسيطرة والفرص لا تعنى شئ في عالم كرة القدم منتخب اسبانيا كاس العالم  عمل  تمريرة في المباراة وطلع من المجموعات الكورة  من البحسم ويستقل انصاف الفرص وشكرا ياسيد عبدالله النعيمي  كل الحب من مدريدي,0,,
qej8hvq2lZo,نطالب بردة فعلك عالسادس,0,,
qej8hvq2lZo,عاردلك يابو العز ان شاءالله كبير انجلترا يرجع قريب,0,,
u8Y9W0rFGZU,مبارة جيرونا و الكلاسيكو  فين يالجبان,0,,
NWsNVfHsuF0,مبروك للنسايب,0,,
NWsNVfHsuF0,استغفرالله العظيم واتوب اليه من كل ذنب عظيم,0,,
qej8hvq2lZo,لبعداو  مغوايرا راس مربع,1,1,1
qej8hvq2lZo,استمر على ردات فعل اليونايتد,0,,
u8Y9W0rFGZU,ياخي ماعندك كرامه انت ورب العزه انا كبرشلوني لاقبل ال٨ ولابعده مااطيق هالفريق البايرن انت تشجعهم يالمضروب وهم داعسينك بكل الوضعيات استح ي رجل فشلتنا كبرشلونيه قسم بالله,1,1,1
EF9RniqmCzM,مدريد حتى الان مامستوعب كيف جاي يفوزون لكن بالتأكيد راح تجي مباراة يتعثرون بيها وبسببها راح ينهار موسمهم,0,,
NWsNVfHsuF0,استهزاء يونس محمود بالسعوديه وريناهم حجمهم الطبيعي,1,1,1
qej8hvq2lZo,منو الي دخل عشان يحط لايك,0,,
qej8hvq2lZo,الدقيقه     تقصد مسي,0,,
qej8hvq2lZo,قارن بين  و,0,,
qej8hvq2lZo,"تعال شجع البيرن يارجال
عادي في ناس واجد بطلو ايشجعو  اليونايتد 
أو برشلونه وغيرو",0,,
EF9RniqmCzM,مهما كنا سيئين بس المجموعات نعديها حتى لو لعبنا برديف,0,,
gvURpU4zGuQ,خلاص ياخي  احنا احباش  خلصونا من المنواشات في التعليقات,0,,
u8Y9W0rFGZU,دمك تقيل وحمار ما بتفهم بالكوره  والريال مدريد لو اجا بمنامك لح تعملها على روحك,1,1,1
oeNHYAiggks,بصراحه علاء وربي انك صادق الفانزات حقين باور يشخصنون بسرعه و ما يشوفون النصيحه نصيحه لا يشوفونها سبه كانه احد سب امهم او ابوهم حقيقي مو صاحين يشخصنونها و يشدونها بسرعه بسرعه يحترقون بس عشان كلمه حتى انها مو سبه و المشكله كل اللي بتعليقات يسبون مع انك قلت انك ما تكرهم و لا قلت شي غلط عنهم بس هم لا سبحان الله كل شي يشوفونه سبه,0,,
qej8hvq2lZo,تضحك على برشلونه لأنهم لقمو ثمانيه و انتو الحين لقمتو الدنيا دواره,1,1,1
qej8hvq2lZo,ابلاع شكد غثيث,1,1,1
NWsNVfHsuF0,"اقل شي احترم مشجعين العراق ، وش التعليق على هدف العراق  

تمام شجع منتخبك بس انت على قناه وعندك مشجعين عراقيين  

الله المستعان بس  
وتقولوا ليش العرب ماحررت القدس",0,,
NWsNVfHsuF0,"مبروك لمنتخبنا الفوز ، و إن شاء الله البطولة 

الحمدان سكتهم",0,,
NWsNVfHsuF0,تم دعس دوله الزنا بنجاح,1,1,1
qej8hvq2lZo,ارنولد ظهير بعد انجليزي ي جلوري اذا انت ناسي,0,,
qej8hvq2lZo,ياحليلك يا الدب,1,1,1
EF9RniqmCzM,كورتوا مصاب ميليتاو مصاب فينيسيوس مصاب همه اهم لاعبين في الفريق وبدون راس حربه وكل هاذ والريال يقدم كل ما عنده وتكول فريق ممل على اساس السنه الفاتت برشلونه كل لعبه يفوز ٣ و ٤ و ٥ اغلب الفوز  وقفل الدفاع خليك منطقي مو كاضيهه تصيح فريق مملل وصداره موقته مو انت تعلم الغيب استغفرالله,0,,
NWsNVfHsuF0,الحمد  لله  الف مبرووك  لابد الانتباه للقادم  وعدم  التكاسل,0,,
qej8hvq2lZo,ابلع ال,1,1,1
oeNHYAiggks,احس انك كبرت الموضوع بزياده  المشكله بلفانزات,0,,
qej8hvq2lZo,والله مان يونايتد صاير زبالة يا شيخ,1,1,1
qej8hvq2lZo,اعجبتني الثقه بداية المباراة,0,,
NWsNVfHsuF0,من الجزائر   واقول الألف مبروك فوز المنتخب السعودي  فوز بجدارة واستحقاق  وهاردلكم للمنتخب العراقي ونصيحه للجمهور العراقي المدرب الاسباني خيسوس كاساس يقيل مدرب فاشل جدا,0,,
NWsNVfHsuF0,في است يونس محمود ثلاثه اخرص يايونس,1,2,1
qej8hvq2lZo,بس بعيد عن الكورة وانا ادري النتيجة ثقيلة لكن حرام تلعن ايا كان,0,,
u8Y9W0rFGZU,هذا الكائن مريض انا مستغرب كيف قناة النعيمي ٢مليون مشترك لايفقه شي في كرة ااقدم,1,1,1
qej8hvq2lZo,شوف برشلونه انهزم  في الابطال في دور الـ  بشهر  وتهون عليك مصيبتك,0,,
u8Y9W0rFGZU,ستظل وضيع وتشجع فريق وضيع وصياحك طرب طرب طرب,1,1,1
qej8hvq2lZo,لالالالالالالالالالالالالالالالالالالالالاالالالالالالالا يونايتد يا كلبب دفاع,1,2,1
u8Y9W0rFGZU,ابلع يا  ، يا و يا  ، كمل انبطاحك,1,2,1
u8Y9W0rFGZU,فقط كن محرجا,0,,
qej8hvq2lZo,القم لمن خسر الستي غضيتون,1,1,1
qej8hvq2lZo,ماغواير ياثور ياثلاجة يابو راس مربع والله قتلتني من الضحك,1,2,1
qej8hvq2lZo,يابو راس مربع,1,1,1
EF9RniqmCzM,والله الشوط الثاني ريال سوسيداد اختفو كليا بالذات بعد هدف فالفيردي جفنا انهيار مستوى ريال سوسيداد وهذا شي طبيعي لان كل الفرق الي تلقم هدف من الريال تصيدهم ربكة يا النعيمي صياحك طرب,0,,
NWsNVfHsuF0,يونس محمود وينك,0,,
NWsNVfHsuF0,حلو السعودية,0,,
u8Y9W0rFGZU,البحرين بلد غشاش، ننتظر في إندونيسيا، أيها الخاسرون، سأدمر لاعبي البحرين,1,1,1
qej8hvq2lZo,القم تذكر البرشا؟؟,1,1,1
qej8hvq2lZo,"السادس من هاري كين 
ارحموا عزيزاً قوماً انذل",0,,
qej8hvq2lZo,جلوري كان يسب,0,,
u8Y9W0rFGZU,دقيقه يل نعيمي انت تشجع البايرن ؟؟ البايرن مو جالد فريقكم جلد شلون تسمح لك كرامتك كبرشلوني تشجعه  ولله العظيم فعلا انت مهووس بريال مدريد,0,,
NWsNVfHsuF0,"الف الف مبروك لاخوانناالسعوديين وهاردلك اخوانناالعراقيين
 بس باذن الله الكاس كويتي محبكم من اليمن",0,,
NWsNVfHsuF0,الف الف الف مبروك للأخضر السعودي,0,,
qej8hvq2lZo,ابو راس المربع,1,1,1
NWsNVfHsuF0,هذا درس لأي احد يفكر يتحدى السعودي ويمسه في وطنه لا بالكوره ولابالسياسه تتحدون السعودي والله ان ندوسىكم ولا نراكم شي الموضوع صار خارج نطاق الكوره وتعليقاتهم كانت سب في السعوديه وجاهم الإلجام عشان تعرف حجمك عند السعودي,1,1,1
NWsNVfHsuF0,ليش الأردن مايلعبون في كاس الخليج معنا,0,,
u8Y9W0rFGZU,لما اسمع الجحشلوني يتكلم عن الحظ يحسسني ان تسجيل الاهداف شيء خارق للعادة ويطبقه الريال والله ما غلط يلي قال ان البرشلوني حمار، يشجع البايرن يلي اغتصبه بالثمانية,1,2,1
qej8hvq2lZo,يا دب,1,1,1
NWsNVfHsuF0,بلنتي حبك عبدي,0,,
qej8hvq2lZo,"عاد كنت أبي اشوف ردة فعلك على نظرة مورينيو ف آخر المباراة بعد السداسية ، بس شفنا اشياء اقوى ه
هاردلك للشياطين الحمر ، ومبروك للدُوجاج",0,,
qej8hvq2lZo,ومين من الجاچ,0,,
qej8hvq2lZo,هيندرسون من اهم اسباب حصول ليفربول على الدوري الموسم الدي فات وترا فيه ارنولد انقليزي في ليفربول,0,,
oeNHYAiggks,تمساح  لما تخيلاتو صغير  طلع اكبر من حجمو فيديو ،,0,,
NWsNVfHsuF0,"الحمدان صدمني ورب الكعبه
ما شاء الله عليه",0,,
qej8hvq2lZo,"الفريق ناقصة اقل شي  صفقات منها  مدافعين 
مشجع انترميلان مر من هنا",0,,
NWsNVfHsuF0,من اليمن الف مبروك اخونا السعوديان وأن شاء الله الكاس من نصيبكم,0,,
NWsNVfHsuF0,تم سحق الروافض بنجاح,1,1,4
EF9RniqmCzM,ياخي دعنا من الخرابيط يعني لنفترض ان ليفاندوفيسكي سجل  اهداف في خمس مباريات راح نقول لولا ليفاندوسكي لكان البرصا ينافس على الهبوط هذا كلام تافه من وبعدين انشلوتي لو لم يكن بيلنجغهام موجود رح نشوف تشكيلة اخرى,0,,
qej8hvq2lZo,صاح صاح,0,,
qej8hvq2lZo,"المعلق 

سون جن جنون الكوري

غلوري جن جنون الآدمي اهو",0,,
qej8hvq2lZo,خلي البلنتيات تفيدك,0,,
u8Y9W0rFGZU,عبد الله الكلب ، الآن فهمت تصريح توني كروس عن السعوديين و العرب خاطيكم كرة قدم,1,2,1
u8Y9W0rFGZU,قسم بالله اقدر انسان شفته على الوجه الارض هو انت وين اكو مشجع يشجع اللي طلع فريقه بنتيجه  وكان معاهم ميسي انت هذا الموسم اربع لونا مو برشلونا روح صلح فريقك بعدين تعالوا ريال مدريد انجز فريق بالتاريخ,1,2,1
EF9RniqmCzM,ياخي اعطي حق ريال مدريد كل مرة لازم تنتقد ريال مدريد لو صحيح فريقك احسن كان متصدر الدوري الاسباني,0,,
qej8hvq2lZo,يا جلوري أفرح لأن ليفربول خسر من ستون فيلا ٧٢ أما مانشستريونايتد خسر من توتنهام ٦١ شوف الفرق,0,,
qej8hvq2lZo,هناك ارنولد في ليفربول و هو لاعب مميز,0,,
u8Y9W0rFGZU,تم الغا الاشتراك,0,,
qej8hvq2lZo,هندرسون الظهر اليمين الكسندر ارنولد المدافع جومز في فريق ليفربول يا اخي,0,,
u8Y9W0rFGZU,الحمدالله استوعب ان يرد ينزل هني ، ينزل بسناب و معاه مليون الف خبر و سنابه يكرهك انك تشوف ردة فعله  ، و لحظه شلون هذي اسوء مباراه ماني فاهم في ١٠ مباريات اسوء بس الظاهر لان مدريد كان مستواه جيد كمجمل فا ما عجبتك,0,,
NWsNVfHsuF0,تم جلد العراق,1,1,1
NWsNVfHsuF0,ياالله ياالله ياالله ياالله ياالله ياالله ياالله ياالله ياالله ياالله ياالله ياالله ياالله ياالله يارب يارب يارب يارب يارب يارب يارب يارب اللهم صل وسلم على نبينا محمد وال سيدنا محمد ياعلي ياعلي ياعلي ياعلي السلام على السيدة فاطمة الزهراء سيدة نساء العالمين اللهم عجل لوليك الفرج ياصاحب الزمان ادركني يامهدي,0,,
u8Y9W0rFGZU,بلا متستحي لابس تيشيرت فريق ضاحك عليك ضحك مولر ميلام بيكم والله,0,,
qej8hvq2lZo,ازرط صار عندنا لعبيين مهريين اه,1,1,1
u8Y9W0rFGZU,عقلية صغار اوروبا,1,1,1
u8Y9W0rFGZU,"الزوجة الصالحة التي تشجع زوجها في كل الاحوال  

احلا شي برشلوني يشجع الفريق اللي خسره  بمباراه واحده",0,,
EF9RniqmCzM,امنيتي اسمع مشجع برشلونه يتكلم عن ريال مدريد بحياديه بدون تعصب بس مع الأسف كلهم اطفال اي نعم كلهم اطفال,0,,
u8Y9W0rFGZU,الاجمل في المقطع هو صياحك والله,1,1,1
EF9RniqmCzM,مو راضي عن اداء مدريد خصوصًا اخر مباراة ماكان نستاهل الفوز صراحة  وجهة نظر,0,,
u8Y9W0rFGZU,انا عارف انك مسخره بس ماهقيتك تشجع اللي جالدك  ليه كذا يالغريم,1,1,1
NWsNVfHsuF0,بصراحة فارق كبير بالمستوى بين السعوديه والعراق,0,,
EF9RniqmCzM,مسكين يا فشلوني اقلب وجهك بس مافيكم واحد يعرف يقول الحق او ينصف تت يلا,1,1,1
qej8hvq2lZo,"الناس قالت رونالدو و نيمار و ساني و هازارد و ماني
طيب و الاسطورة هيونغ مينغ سون
ليش الناس ماقلته
عشان كوريا الجنوبية
ياناس شوفو وين راحت العنصرية
والله اني اشوف انه يستاهل الكرة الذهبية
ظلم ياعالم والله ظلم",0,,
EF9RniqmCzM,وأخيرا نزلت مقطع,0,,
qej8hvq2lZo,قلب مارادونا في مباراة الارجنتين ونيجيريا,0,,
u8Y9W0rFGZU,مهزق  ادل انسان اراه,1,1,1
u8Y9W0rFGZU,انته تمضرط شنو سلكان,0,,
NWsNVfHsuF0,والله هذول الجرابيع ميستهلوش الفوز شوية رعاع,1,1,1
EF9RniqmCzM,ويلكم ويلكم اشتقنا لصياحك صارلك زمان ماسمعتنا صياحك,0,,
NWsNVfHsuF0,من اليمن الف الف الف مبروك لاحفاد الصحابة ااسعودية القلب,0,,
qej8hvq2lZo,"ياعيال 
ياجماعة الخير
اش كلتلكم",0,,
qej8hvq2lZo,والله احنا من قهري مثلك بس الله يوفقك,0,,
NWsNVfHsuF0,"السعوديين دعسو على شرف العراق 
اه صح العراق ماعندهم شرف 
خلص دعسو على وجوه العراقيين",1,2,1
NWsNVfHsuF0,"المنتخب العراقي بدأ سنة  
بثلاثية من الاردن  وانهاها بثلاثية من السعودية الف مبروك لسعودية الشقيقة",0,,
qej8hvq2lZo,الي بعدو الي بعدوو,0,,
qej8hvq2lZo,"ابلع الاول يا شيخ 
الله لا يحطني مكانك",1,1,1
NWsNVfHsuF0,كلو يا زعيم,0,,
qej8hvq2lZo,حبيبي جلوري انا احبك واتابعك بس احبك اقلك القم,1,1,1
qej8hvq2lZo,فريق عاهات بس ليش ماكملت وللمعلومية خلصت   ولله دفاع برشلونه احسن من حقكم,1,2,1
qej8hvq2lZo,اقول اسكت وخلي ضربات الجزاء تنفعك,0,,
qej8hvq2lZo,ما استبعد انه يونايتد بيهبط بس صدقوني انه اليونايتد بيرجع لمستواه بس نهايت الموسم ومانشستر بيطلع من دور ال في دوري الابطال,0,,
EF9RniqmCzM,المبارة صد ريال بتيس يمكن افضل مبارة لبرشلونة منو وقت خروج ميسي اتمنى الفريق يستمر بهذا الشكل,0,,
qej8hvq2lZo,خلاص ياخي اترك الفريق وبس وبترتاح صدقني,0,,
NWsNVfHsuF0,اريد ان ارى وجه يونس التيس بعد هذه المباراه,1,1,1
qej8hvq2lZo,يا جلوري عندك عين قوية تكلمت عن المقارنة بين راس مربع مع فان دايك بلعو,1,1,1
NWsNVfHsuF0,والله انتوو متمثلون العراق,1,1,1
qej8hvq2lZo,استغفر على الالفاظ اللي قلتها واللعان ترا حرام,0,,
NWsNVfHsuF0,من الاردن الف الف مبروك المنتخب السعودي الكبير كبير ا,0,,
qej8hvq2lZo,"من يضحك أولاً يبكي آخر ً 

آسف إذا زعلت",0,,
qej8hvq2lZo,والله يا غلوري زيي زيك ما كملت المباراة بسبب العصبية والقرف من هذا اللعب,0,,
EF9RniqmCzM,ترة انتم بس مباراة وحده قدمتم بيها اداء جيد طبلتم لبرشلونه حتى رشحتوهم لدوري الابطال بعد,0,,
NWsNVfHsuF0,دعسنكم في الكوره وسوريا ياعراقيين,1,1,1
u8Y9W0rFGZU,يا سفولي يا مهرج,1,2,1
qej8hvq2lZo,الليفر خسر من عينك يارجل,0,,
qej8hvq2lZo,الي يريد جلوري يسوي ردة فعل على اليكس تيليس علشانه انتقل لمانشستر يونايتد يصف جنبي,0,,
qej8hvq2lZo,سبحان الله وبحمده سبحان الله العظيم,0,,
qej8hvq2lZo,العب فيفا,0,,
qej8hvq2lZo,انته اتغلط على مكواير ابو كرش,0,,
qej8hvq2lZo,تعيش وتاكل غيرها انا مانشتراوي مقهور من النتيحه بس بعد ما شفت ليفربول راحت العصبيه,0,,
qej8hvq2lZo,خسرت يمنوب تدحك على البارسا إبكي على ينيت,0,,
qej8hvq2lZo,هاي اخرت الشماتة في برشلونة,0,,
gvURpU4zGuQ,"هي واحدة من الثنتين يا ان اليمن اصل العرب يا ان اغلب ارض الجزيرة العربية يمنية 
لم يأتي الاسم من فراغ",0,,
qej8hvq2lZo,جلوري هياط في البداية وانشق اليونايتد  بعدين ه,1,1,1
qej8hvq2lZo,"يا فضيحتك يا جلوري على هالنتيجه
ملاحظه انا برشلوني استر على ما وجهت",0,,
qej8hvq2lZo,"جلوري في بداية المباراة  هات الي بعدو 
جلوري في نهاية المباراة  خسران",0,,
EF9RniqmCzM,لا تتكلم عن الكرة اذا تشوف مدريد مش ممتع,0,,
NWsNVfHsuF0,تم الجلد الي بعدو,1,1,1
u8Y9W0rFGZU,صيح يابورياله صيح,1,1,1
NWsNVfHsuF0,سباب خسارة العراق هو تصريح يونس محمود  انت مسؤل في المنتخب العراقي  تستهزي في فريق راح يلعب معك  اغبى مسؤل شفته في حياتيي,0,,
u8Y9W0rFGZU,"تخيل اشجع فريق طاحن فريقي 
ثاني شي النعيمي انته غبي من متى في حظ ف الكوره يعني الحظ ترك كل الانديه و هبط ف مدريد 
اغبى برشلوني ف التاريخ
اذا ما كان فريقك قادر يسوي الي يسويه الريال لا تقول حظ 
يا وضييع",1,1,1
u8Y9W0rFGZU,ياخي بالله عليك مبلعينك  و لسا صامل ه,1,1,1
qej8hvq2lZo,ابلع ي البيض,1,1,1
qej8hvq2lZo,لاحول ولا قوة الا بالله فريق تعبان هجيبلي جلطة,0,,
NWsNVfHsuF0,الشعب السعودي يكتبون تعليقات ولولا العراق مكان عرفوا يكتبون اصلا,0,,
qej8hvq2lZo,لا تعايرني ولا اعايرك الهم طايلني وطايلك  ليفر بولي,0,,
NWsNVfHsuF0,أهل القريش,0,,
NWsNVfHsuF0,شو الوضع ياعراقيبن  ليش انهزمتم أخاف علي وباقي ٱل البيت طالعين إجازة رأس السنة ماأعطوكم مراد  ولااهتموا بموضوع كرة القدم الله يهديكم,1,1,4
u8Y9W0rFGZU,كل موسم تبلع اقل شي  و  و وبالأخير بتشجع البايرن,0,,
u8Y9W0rFGZU,هاي أسوء مباراه صح كلامك جان رحت شفت لعبه برشلونه بالنصف ها نسيت برشلونه طالع,0,,
u8Y9W0rFGZU,وعليكم السلام ورحمة الله وبركاته على ماسلمت,0,,
qej8hvq2lZo,المترجم عنفكم وعرفكم حجمكم,1,1,1
qej8hvq2lZo,القمم ه,1,1,1
NWsNVfHsuF0,"يونس محمود لاعب بدون اخلاق
نشكره على الإستفزاز
وين يونس محمودمطلوب اشوفه بعدالمباراة",0,,
EF9RniqmCzM,سبحان الله محسسني برشلونه الموسم الماضي قمة المتعة,0,,
u8Y9W0rFGZU,الحمدلله ان قناتك طاحت ياكذاب,1,1,1
qej8hvq2lZo,هاردلك اليونايتد مبروك الفوز لتوتنهام,0,,
qej8hvq2lZo,"سنة غريبة 

ليفر اكلو  
اليونايتد اكلو 
و السيتي  
وبرشا",0,,
qej8hvq2lZo,ننجتسو الانقلاب,0,,
qej8hvq2lZo,ولك ايبلع جاية تتمسخر على برشلونة شوف فريقك المعفن ذا قال جيبونا الي بعدو  والله مااعرف كيف تشجع هاد الفريق,1,1,1
qej8hvq2lZo,ه  ٩,0,,
u8Y9W0rFGZU,حترك عمك باير ميونخ ميشيلينك  أهداف ولابس تشيريت باير واحد وصخ متعصب غير رياضي,1,1,1
qej8hvq2lZo,متعشم اوي بعد الجون الاول,0,,
qej8hvq2lZo,"خهاي  هاي
يفرح بالاول ويبلع ٦
لما تحكي ع البرسا ايدك ع راسك
لان فريقك عاه",0,,
qej8hvq2lZo,الي بعدوا لقمت ٦,1,1,1
qej8hvq2lZo,المقطع مو واضح  حاول تشوف لك وضع مع الشاشه,0,,
NWsNVfHsuF0,أموال التذاكر   أهل غزاه اولئ بها  اتقو الله,0,,
qej8hvq2lZo,يابو رأس مربع ه,1,1,1
qej8hvq2lZo,"دوري الأنكليزي كارثة كارثة ولله ليفربول خسرت كارثة فاضحة
ومانشستر يونايتد",0,,
qej8hvq2lZo,القم القم,1,1,1
NWsNVfHsuF0,تدرون ليه الحمدان سجل هدفين برجله اليسار لان اليمين حطها بحلق يونس محمود ه,1,1,1
qej8hvq2lZo,ه أبلع أبلع روح يشيخ,1,1,1
u8Y9W0rFGZU,ابلع ياض يانعيمي يافاشل,1,1,1
qej8hvq2lZo,تستاهل يا دب,1,1,1
qej8hvq2lZo,لالاصياح يابو سته ه اتمنى ترد يابو سته ه,1,1,1
NWsNVfHsuF0,من بغداد الف الف الف مبروك لأهلنا في المملكة الغاليه,0,,
qej8hvq2lZo,القم امزح امزح,1,1,1
qej8hvq2lZo,"ي لطيف  موولعة
برشلونة لقم  
ليفربول لقم  
يونايتد 
السيتي  
ايش هذا",0,,
gvURpU4zGuQ,لا انت مؤرخ احتمال بائع بصل لاتهرف بما لاتعرف,1,1,1
qej8hvq2lZo,ابلع يا جلوري   ه  تضحك على برشلونة   وليفربول ه     جميع مشجع ليفربول ابلع كمان,1,1,1
NWsNVfHsuF0,منتخب تعبان,1,1,1
qej8hvq2lZo,عوافي يا جلوري,0,,
u8Y9W0rFGZU,هتلبس تيشرتات الفرق كلها يانعيمي يافاشل,1,1,1
