Video ID,Comment,Toxicity,Type,target
EF9RniqmCzM,مضريط يحسب الحظ سيقف معه ضد عمالقة الأندية  مثل السيتي الموسم الماضي ضربهم وغير القاعدة,1,1,1
qej8hvq2lZo,حتى جدتي تعرف ويش يدور في بالك يا عزيزي المشاهد,0,,
u8Y9W0rFGZU,امرض يوتيوبر,1,1,1
gvURpU4zGuQ,"الخلايجة امراض قلب وعندهم عقدة نقص التاريخ
اووكد انالجزيرة بكاملها كانت مملكة سبأ",1,1,1
oeNHYAiggks,ياخي لا تسبهم شباب مستقبلنا كلنا وبيحققون الي ما سووه الاجانب ليش تحطمهم وتسبهم ولا لك دخل مشاكل بين سعوديين احنى نحلها بيننا مالك دخل اذا انت سعودي تعال تكلم ولا انطم بس يسوون فتنه وعن سالفه ان محد تكلم عنه لان عارفين ان مالهم دخل والمشكله تافهة بس فيك لقافه لله درها انا ما اتابعهم بس شباب بلدي لا تتهجم عليهم فاهم كنت احبك الصراحه بس خيبت ضني,0,,
u8Y9W0rFGZU,ه ياعمي كافي شجعتوا جميع الفرق شبيكم,0,,
qej8hvq2lZo,الله يعينك بس تخاذل الف,0,,
qej8hvq2lZo,المقطع الوحيد الي شفته ٤ مرات,0,,
NWsNVfHsuF0,ألف ألف مبروك للمنتخب السعودي,0,,
qej8hvq2lZo,فل اعلانات,0,,
NWsNVfHsuF0,"من اليمن الله يبارك للأخضر فأنتم تستاهلون الفوز واكثر 
والعراق حظ أوفر للمرة الجاية واتمنى لهم كل خير",0,,
qej8hvq2lZo,يعمري يشيخ بعد  دقايق الله يلعنك ي ثلاجة,1,2,1
qej8hvq2lZo,يابو ديد مثلث,1,2,1
qej8hvq2lZo,ميسي لدينا لا خوف علينا,0,,
u8Y9W0rFGZU,مدريد عمك,1,1,1
gvURpU4zGuQ,"قديما كل مكان جنوب مكة المكرمة يسمى يمن
والحقيقة
مو مهم تكون اليمن اصل العرب او لا المهم تستمر اليمن عربية بعيدا عن نجاسة الفرس وأذنابهم من جماعة الحوثي وخونة الأوطان",1,2,1
qej8hvq2lZo,جلوري يقول هل الانتحار حلال,0,,
qej8hvq2lZo,هات الي بعدوا يشيخ,0,,
qej8hvq2lZo,ولله مصوور المقطع بعد المباراة ماخلصت,0,,
NWsNVfHsuF0,المعلق ضايج من العراق لدرجه حته من قول العراق ماحتفل,0,,
qej8hvq2lZo,من الولد ياجلوري,0,,
qej8hvq2lZo,كنت استناك واللهي,0,,
gvURpU4zGuQ,هذا م عنده اصل واضح,1,2,1
EF9RniqmCzM,حتى برشلونه الموسم الي طاف ماخذ الليغا ومستواه سيء وكان يفوز ب,0,,
NWsNVfHsuF0,في اخبار تقول ان يونس باقي  يضحك للان,0,,
qej8hvq2lZo,القم اخي تذكر يوم انك ضحكت علينا نحن البرشا يوم ما خسرنا بي  القم رغم انك تعجبني لكن الصراحة ابلع شيخ,1,1,1
u8Y9W0rFGZU,اشكد احب اشوفك ضايج حتى تحفيل ماتعرف,0,,
qej8hvq2lZo,نادي سيء عزهم في زمن فريقسون فقط,1,1,1
u8Y9W0rFGZU,النعيمي مازوخي يحب كتل,0,,
qej8hvq2lZo,بس سؤال عندك,0,,
NWsNVfHsuF0,فديت السعودية  الفوز للسعودية أكيد  اختكم من الإمارات و نصها سعودي,0,,
qej8hvq2lZo,جلوري صار يسلك كل شوي ايش قلتلكم قبل شوي,0,,
NWsNVfHsuF0,سقطت الاسود ونبحت الكلاب,1,1,1
qej8hvq2lZo,إحمد ربك الليفر خسر من نادي هابط,0,,
qej8hvq2lZo,قلوري انت مبدع بس اذا جيت تسب حط طوط عشان في صغار يشفون وصلو التعليق فوق,0,,
qej8hvq2lZo,"والله اني انتظر المقطع من زمان

الي جاي من  لايك",0,,
qej8hvq2lZo,غير فريقك والله احسن,0,,
NWsNVfHsuF0,افضل توقيت لصورة يونس محمود و قطع لسانه من الحارس السعودي محمد العويس,0,,
qej8hvq2lZo,يقصد ميسي يوم يقول ضيع بطولات مع منتخب بسبب بلنتي ياحبيبي ميسي ٤ ابطال ناديك ٣ ابطال,0,,
qej8hvq2lZo,ابلع و انجلع,1,1,1
qej8hvq2lZo,يشجع اليونايتد ويتكلم عن العييبه الي مضيعين بلنتيات الله يلدنيا,0,,
qej8hvq2lZo,امام باريس راح ناخد١٦,0,,
qej8hvq2lZo,"دس لايك عشان اللعن الله يهديك 
تراك قدوة لغيرك انتبه",0,,
EF9RniqmCzM,هسه يلا عرفت اوربا بعيده لان البرشلونين كل موسم يگولون قادمون يا اوربا ولحد هسه ما واصلين,0,,
NWsNVfHsuF0,من اليمن الف الف مليون مبروك لسعوديه وان شاءلله من نصر الا نصر,0,,
qej8hvq2lZo,تكفلة حول برشلوني,0,,
qej8hvq2lZo,ولله مسخرا,1,1,1
NWsNVfHsuF0,وين الكابتن يونس أختفاء,0,,
qej8hvq2lZo,"فجعتني يارجل  ه  
هدي وروق وخذ  لايك للمقطع",0,,
u8Y9W0rFGZU,شكد شخص زباله انته تحجي ع تاج وفذر تحجي ع تاج راسك مدريد,1,2,1
u8Y9W0rFGZU,انبح النعيمي لان نباحك ما يهز قوة الريال فوق الجميع,1,1,1
qej8hvq2lZo,علطول سته,0,,
NWsNVfHsuF0,خليك ساكت,0,,
qej8hvq2lZo,"يا بو رأس المربع 
كلمة حلوة",1,1,1
u8Y9W0rFGZU,على الاقل شجعوهم بعد الثأر من,0,,
qej8hvq2lZo,بوقبا صدقني بيطلع من الفريق هو اصلا ناوي يطلع من زمان وبعدة يلقم,0,,
qej8hvq2lZo,الحمد لله جبنا اليكس تيليس وجبنا كافاني وجبنا اماد تراوري والله اداردتنا والرئيس كانو زبالة الحمد لله جبنا صفقات تلحقنا من الفضايخ,0,,
qej8hvq2lZo,"واله العظيم اقسم بالله أكملت الشوط الأول متعصب 
اله ينكب الإدارة الكلب وهاري مغوير الزبال 
يا منستر يونايتد فضيحية انا منشسترو دفاع زبال",1,2,1
u8Y9W0rFGZU,قليل شرف,1,2,1
EF9RniqmCzM,"يعني اذا يريد مشاهدات على منو يحجي على برشلونه اكيد على ريال مدريد لان هو صارله سنين كاتله القهر يشوف الريال وبطولاته و هو يتحسر 
الفريق السيء الي تحجي عليه رد كرامتك كدام الاندية كلها هاي السنين الراحت لو نسيت روما وليفربول و بايرين ميونخ و باريس 
اني لو مثلك اشجع برشلونه ابطل ما اشجع على سنين الي مرت عليكم 
احلم
 ب٦ و ٨ الي تبقالكم الله كريم يجوز يصيرن ٩",0,,
qej8hvq2lZo,الآن حسيت في برشلونه,0,,
u8Y9W0rFGZU,أولئك الذين لديهم قنوات غبية غبية هم مثل الكلاب مثل الخنازير، دول مافيا كرة القدم التي يكون لاعبو منتخبها الوطني مثل المعاقين الذين يتم ضربهم قليلاً وتدحرجهم من قبل لاعبي كرة القدم أو البنجولين,1,2,1
NWsNVfHsuF0,يا سلامي عليكم يالسعودية  مبروك,0,,
qej8hvq2lZo,شجع مدريد تنجلط اكثر من السطح بنزيما الله يخظه يارب,1,1,1
qej8hvq2lZo,ھهۃفاكيوو طرامب,1,1,1
qej8hvq2lZo,مايستاهل مارسيل احمر لان هاذاك الكلب ضرب اول ومتعمد ولا عطاه احمر,1,1,1
u8Y9W0rFGZU,"انت قذر واستمتع بصياحك يطربني لان روحك مو رياضيه 
انت حاقد",1,1,1
NWsNVfHsuF0,ايزي والله صقورنا,0,,
NWsNVfHsuF0,الف مبروك للمنتخب السعودي السقيق,0,,
qej8hvq2lZo,وإيش ذنبك إنك تشجع اليونايتد,0,,
qej8hvq2lZo,نادي زربه,0,,
qej8hvq2lZo,برونو ه,0,,
NWsNVfHsuF0,يعيش   يونس محمود  رمز من رموز الكره العربيه,0,,
qej8hvq2lZo,احسان لمان يضحك عله برشلونه الحين نطقطق على ه,0,,
gvURpU4zGuQ,"سفينة نوح رست فوق جبل الجودي في صنعاءوهي متحجرة الان ، وليس كما ورد في روايات اليهود المحرفة ان الجودي جبل يقع في جبال تسمى 
ارارات شمال العراق وشرق تركيا ،بل ان جبال التنور موجودة في اليمن 
وسام بن نوح بنى صنعاء واولاده هاجروا الى العراق 
والشام وغيرها",0,,
u8Y9W0rFGZU,متعودين عل يكائك يا حظ يا تحكيم ابلع شجع فريق الي وكلك,1,1,1
qej8hvq2lZo,يا ابو راس مربع بموت ه,1,1,1
NWsNVfHsuF0,من يتفق معي انها افضل نسخه من كاس الخليج,0,,
u8Y9W0rFGZU,احلى شي الصياح,1,1,1
qej8hvq2lZo,لاتسب تكف,0,,
NWsNVfHsuF0,من المغرب، مبروك الفوز للمنتخب السعودي الشقيق و هاردلك للمنتخب العراقي الشقيق مباراة رائعة و ممتعة و حماسية بالمزيد من النجاح و التوفيق للمنتخبين الشقيقين ان شاء الله,0,,
qej8hvq2lZo,ابلع السادس ابلع مانشستر يونايظيط,1,1,1
u8Y9W0rFGZU,نباحك طرب,1,1,1
qej8hvq2lZo,غير فريقك ولا بتموت شجع فريق كل سنه بطوله مثل خلال احسلك وربي,0,,
qej8hvq2lZo,استمتع بصياح مشجعين اليونايتد,1,1,1
qej8hvq2lZo,تذكر يوم الي قلت مهزلة  على فضية برشلونة امام بايرن و الان صارت مانشستر يونايتد مهزلة امام توتنهةم,1,1,1
u8Y9W0rFGZU,لو تلبس الكبت كله انت امام حضره الريال,0,,
qej8hvq2lZo,ابلع اقول ابلع,1,1,1
qej8hvq2lZo,مورينهو جلدهم جلد,1,1,1
NWsNVfHsuF0,المنتخب السعودي يبصق على يونس محمود,1,1,1
u8Y9W0rFGZU,ياريت تعتزل ردات الفعل لان محتواك خايس صراحه ولا عندك روح رياضية,1,1,1
qej8hvq2lZo,لسسى ابغى اعدل لسسى بلنتي من البدايه القم  ي حب ه,1,1,1
EF9RniqmCzM,يا برشلوني زفت مدريد عمك,1,1,1
qej8hvq2lZo,الكم ٦ من عمك مورينيوو,1,1,1
qej8hvq2lZo,والله انا ماشايل إلا همك إنته وشنب لانكم ماشستراوين وخايف عليكم لا يجيكم الضغط من هاذا الفريق ه,0,,
NWsNVfHsuF0,دعسنا الشيعي والجاهل، وطردناهم من الكويت مرتين كرويا وعسكريا,1,1,1
qej8hvq2lZo,ملاحضين انو كلوري حسد ليفربول من كال ليفربول احسن من اليونايتيد بعد مباراتهم خسرو ليفربول,0,,
qej8hvq2lZo,"والله انك كفو تسوي ردة فعل على فرقك الخسر بفضيحة وما طلب شي 
مش زي بعض ناس تطلب لايكات مشان مايحذفو ب ساعة",0,,
qej8hvq2lZo,المقطع عبارة عن ضحك,0,,
qej8hvq2lZo,جلوري اذا يبقاء يشجع المانيو ينجلط,0,,
qej8hvq2lZo,حياك الله يا جلوري احبك,0,,
EF9RniqmCzM,رسميا  دقيقة من الصياح,0,,
qej8hvq2lZo,"جلوري مدح ليفربول قبل مباراة ليفربول مع استون فيلا 
و انا عم قول ليش هيك صار بليفربول",0,,
EF9RniqmCzM,ويل لاروبا من الضحك,0,,
NWsNVfHsuF0,يونس مكتوب بالقران الكريم,0,,
qej8hvq2lZo,ارنولد في مهب الريح,0,,
NWsNVfHsuF0,من قلب اليمن الف الف الف مبروك للملكة,0,,
qej8hvq2lZo,جلوري شجع غير نادي فدوه لربك يونايتد فشلت,0,,
qej8hvq2lZo,تذكر لمن كلت البايرن خلطوهم على برشلونه بمباراة   ونتو خسرتوا    خلوطوكم خلط بس ميخالف ابقه اتابعك,0,,
gvURpU4zGuQ,"ومازالت عقدة  النقص  تقض مضاجعكم يالسعوديين    
سواءً  كانت اليمن  أصل العرب  أم لا    فشعوركم متوارث   بأنكم اقزام امام اليمن",1,1,1
NWsNVfHsuF0,الف مبروك لمنتخبنا الثاني الفووز، البطولة والكاس سعودي، لان لك مجتهد نصيب، والمنتخب السعودي بصراحة تعب علشان ينشى هذا الجيل، لابد للكرة ماتنصف المثابر، يمني مر من هنا، تحياتي لكم,0,,
qej8hvq2lZo,ارنولد ؟,0,,
u8Y9W0rFGZU,من اغبى صانعي المحتوى اسلوبه حقير بيستهين بحلف اليمين,1,1,1
NWsNVfHsuF0,"المنتخب السعودي يصنع اللعب و يبادر و المنتخب العراقي يلعب على رد الفعل 
الف مبروك للاخضر السعودي و حظ أوفر للمنتخب العراقي",0,,
qej8hvq2lZo,يونايتد خذوا اليكس تيليس,0,,
qej8hvq2lZo,يالله يالله ابلع,1,1,1
qej8hvq2lZo,مبابي و نيمار يستنونك ه,0,,
u8Y9W0rFGZU,مين انت حتى تقول بلنتي صحيح ولا مو صحيح اصلا كل دول الخليج لا علاقة لهم بكرة القدم,0,,
NWsNVfHsuF0,هيا ابلع يا ذيل,1,1,1
qej8hvq2lZo,"ليك شو مبسوط
 ليش معصب
امزح 
احبك جلوري",0,,
qej8hvq2lZo,سعر لاعب الدفاع٨٠مليون تجيب دفاع جلاد شف ذا المدرب الكلب شف ليفربول شراءفان  وشف ذا,1,2,1
qej8hvq2lZo,تحمسس زيادة هات ليبعدو بلعوكم ٦,1,1,1
NWsNVfHsuF0,شكرا يونس استفزت لاعبيننا المزاجيين،، ياليت واحد من عمان يستفز لاعبيننا لانهم مايلعبون الا للرد على التصاريح اما شعار الوطن فيبدوا ان الامر عادي,0,,
NWsNVfHsuF0,"مبروك للعراق انه بس اجوا فيكم ثلاث منتخب منفوخ 
الف تحيه للسعوديه من الاردن
بس دقيقه من ووقتك اضحك على عراق",0,,
NWsNVfHsuF0,المعلق سعودي,0,,
u8Y9W0rFGZU,انسان فاشل وتافه وغثيث بكل معنى الكلمة مكروه ومحد يحبك ومحد يطيقك بكل معنى الكلمة يالمقرف,1,1,1
qej8hvq2lZo,ابلع ابلع ابلع,1,1,1
qej8hvq2lZo,الله يكون بعونك,0,,
NWsNVfHsuF0,شكرا امجد عطوان لأنك افضل لاعب اما ابراهيم بايش وعلي فائز ومناف يونس افشل لاعبين مرو على تاريخ المنتخب وايمن حسين يقضي الوقت واقف بالملعب ويريد الكرة تجي تضرب براسة,1,1,1
qej8hvq2lZo,افعل ردت فعل على مباره ليفربول  ٧ ٢,0,,
qej8hvq2lZo,احمد ربك منتا خاسر  من استن فيلا زي ليفربول,0,,
NWsNVfHsuF0,إستهانوا بالصقر الأخضر ظناً منهم أن مخالبه قد تكسرت ولم تعد حادةً كالسابق ، ففاجأهم بمخالب مرعبة لا تعرف الرحمة,0,,
u8Y9W0rFGZU,سؤال تعرف شنو يعني كرامة ؟,0,,
u8Y9W0rFGZU,طيب ليش تجشع الي خزعك,0,,
qej8hvq2lZo,صياحك يطرب,1,1,1
u8Y9W0rFGZU,بالله الكريم اخيس يوتيوبر شفته بحياتي من جان يشجع برشلونه جان خايس ومن شجع بايرن الي بلعو  صار اخيس من قبل بشر عباره عن لعبان نفس وجيفه شكد ما احجي ما اكدر اوصف كمية قذارته,0,,
qej8hvq2lZo,قتلني يوم سب رئيس,0,,
u8Y9W0rFGZU,والله اذا الحيوانات تفهم في كرة القدم انت تفهم يا نعيمي مع كامل احترامك الي غصباً عنك,0,,
qej8hvq2lZo,ه ماكمل هدف سادس,0,,
u8Y9W0rFGZU,مجالس فقه النفس دعبدالرحمن ذاكر الهاشمي,0,,
u8Y9W0rFGZU,كل لايك يزيد عمري انا عمري الحين صفر,0,,
u8Y9W0rFGZU,"انت اكثر شخص ماعنده شخصية شفته بحياتي 
تشجع النادي الي صارله  سنوات مبهذلك وماسح بيك اوربا كلها",1,1,1
qej8hvq2lZo,ابلع ابلع ه,0,,
EF9RniqmCzM,"سمعني صياحكم يابو صدارة ستوري
وشوفونة مراجلكم بدوري الأبطال مو على ريال بيتيس",1,1,1
EF9RniqmCzM,اوه احلى شي نباح دا الادمي,1,1,1
u8Y9W0rFGZU,"الحمار يفهم اكثر منك بالطابة  
مع احترامي للحمار",1,1,1
gvURpU4zGuQ,انت ولد هنديه شكلك,1,2,2
NWsNVfHsuF0,المنتخب السعودي يمتلك اقوى هجوم باسيا  كاساس انتهت الصلحيه اكسباير لازم انتقيله ورانا منتخب الكويت المتطور والاردن الند القوي والكوري الخصم الصعب في تصفيات كاس العالم,0,,
qej8hvq2lZo,ه والله يا انهم جلدوكم جلد، بس والله دفاعكم زبال كثير رفعولي ظغطي و اني ما اشجع اليونايتد,1,1,1
NWsNVfHsuF0,من اليمن الف الف الف الف الف الف الف الف الف الف الف الف الف الف مليون مبروك لمملكة التوحيد والكرم والنخوة,0,,
qej8hvq2lZo,جلدكم المترجم ه,1,1,1
qej8hvq2lZo,"ه 










القم",1,1,1
qej8hvq2lZo,ابلع جلوري,1,1,1
u8Y9W0rFGZU,"اذا هو شوط خايس ليش تتابع المباراه
و ثانيا و الله ردت فعلك وايد خايسة و انت خايس وردت فعلك زبالة يا زبالة",1,1,1
qej8hvq2lZo,انتم تلقمون وليفربول لقم,1,1,1
u8Y9W0rFGZU,اول مرة بشوف حدا بيشجع فريق مغتصبو,1,2,1
qej8hvq2lZo,يعمي فريق اليونايتد زباله,1,1,1
u8Y9W0rFGZU,ماتستحي تشجع البايرن  الحمد لله علي نعمه الريال,0,,
oeNHYAiggks,ايوه يستاهلون السامجين,1,1,1
u8Y9W0rFGZU,يا اخي انت عندك كرامه ؟,0,,
u8Y9W0rFGZU,ريال مدريد عمك,1,1,1
NWsNVfHsuF0,الف مبروك لسعودي من   والعراق,0,,
oeNHYAiggks,أخيرا احد تكلم عن مزبله بور,1,1,1
EF9RniqmCzM,مينو مهتم برأيك يا زك,1,2,1
qej8hvq2lZo,القم يا شيخ لا عاد تتحمس ع هدف وانت تشجع يونايتد  امزح معاك احبك والله,1,1,1
qej8hvq2lZo,ابلعو يا يونايتد,1,1,1
qej8hvq2lZo,"قصدك ميسي 
ابلع",1,1,1
NWsNVfHsuF0,ضحكة هزت الخليج الفارسي كله,0,,
NWsNVfHsuF0,ه دجاج الرافدين,1,1,1
qej8hvq2lZo,ماعندنا لاعب جيب لي بعدو,0,,
u8Y9W0rFGZU,عبدالله كلما يريد يتوب ويتعض يرجع يصيح ويرجع ينجلط,0,,
NWsNVfHsuF0,أكبر درس للوقح يونس محمود حتى يتأدب ولا يتجاوز ويستهزئ بالسعودية مره أخرى، مع العلم أن هذا النكرة لا يمثل إلا نفسه ولا يمثل المنتخب العراقي المحترم ولا يمثل الشعب العراقي الشقيق، مبروك لمنتخبنا وهاردلك لأشقائنا وأخوانا في العراق الحبيب,1,2,1
u8Y9W0rFGZU,والله بعض مشجعين برشلونه مايهم الخصم مين حتى إذا خصم اهانه وصاقه ٨ عادي يشجعه مافي كرامه وربي  والمشكله مدريد بيفوز وتأهل وينغبنو اكثر,0,,
qej8hvq2lZo,وين رايح اسا في السادس,0,,
NWsNVfHsuF0,"ارفع راسك انت سعودي 
طيبك جاوز كل حدودي 
غيرك ينقص وانت تزودي",0,,
NWsNVfHsuF0,مبرووك للمنتخب السعودي,0,,
NWsNVfHsuF0,طز طز طز طز طز السعوديه،,1,1,1
NWsNVfHsuF0,الف مبروك من الاردن الى الحبيبن السعودي انتم كنتم الفضل,0,,
qej8hvq2lZo,عشان كذا ليفربول لقم ٧  ماشاءالله عليك يا جلوري صبتهم عين جبت اجلهم,0,,
qej8hvq2lZo,اول جلوري احبك,0,,
qej8hvq2lZo,ثلاجة ، ابو راص مربع,1,1,1
qej8hvq2lZo,ليفربول انهزمو,0,,
qej8hvq2lZo,أبحث عن فريق أخر تشجعه,0,,
NWsNVfHsuF0,الكل واحد والكل فايز المهم اننا اجتمنا على خير,0,,
NWsNVfHsuF0,منتخبنا الغالي، صقورنا الأبطال، كم يطيب لنا أن نُبارك لكم هذا الفوز، كما ونبارك لأنفسنا جميعًا، ومزيدًا من تحقيق الفوز بإذن الله,0,,
u8Y9W0rFGZU,"اقسم بالله انك اقرف مشجع بتاريخ كرة القدم انت اقرف مشجع و ماتعرف كرة القدم اصلاً 
 مليون مشترك على ايش ؟ على انك تكره مدريد ؟ عشان تقول مدريد مقرف ؟ محتواك كله باليوتيوب على ريال مدريد يخي شف حياتك و اترك الكورة لمشجعينها يلي يفهمونها",1,1,1
qej8hvq2lZo,انت تكمل المباراه عشان حنا نضحك,0,,
qej8hvq2lZo,أترك اليونايتد ترا بزعة من عيشتي ورا ما شفت المقطع الحمدلاه شجعت الستي السيتي السيتي السيتي الموهم أترك اليونايتد وشجع السيتي ترا حياتك الكوراويه بلااأاش,0,,
qej8hvq2lZo,خلطوكم خلط,1,1,1
qej8hvq2lZo,اليونايتد في الاتجاه نحو الطريق المنحدرة,0,,
u8Y9W0rFGZU,كل خره ولا تزوز ع سيادك ولا تكول خياس ع تاج راسك والله نسوي عليك حمله نرجعك لصفر,1,1,1
qej8hvq2lZo,وطي صوتك ياض يا عجل,1,2,1
u8Y9W0rFGZU,اطربني بصياحك,1,1,1
NWsNVfHsuF0,مبروك الفوز المنتخب السعودية وهاردلك العراق من الجزائر,0,,
qej8hvq2lZo,ه خلطوهم,1,1,1
NWsNVfHsuF0,الف الف مبروك لخواننا السعودين ع الفوز,0,,
qej8hvq2lZo,"انا اسف  عشاني اشجع توتنهام خلاص سامحني طيب بطق طق عليك،

يلا اللقم انت  و ماغوير يا شيخ ماغوير كان من افضل المهاجمين الي لعبو معنا في توتنهام امس",1,1,1
u8Y9W0rFGZU,اوف الصياح رجع,1,1,1
EF9RniqmCzM,"طيب احنا مشجعين الريال شو نعمل
هاد شغل بيريز وانشيلوتي
الفريق سيء ولكن يفوز الحمد لله في شوية حسنات في الفريق
ولكن يعني شو نعمل الفريق في اسوء حالته يفوز  
خلينا نفرح شويه 
لانه بيريز ما راح يعمل اشي ولا راح يحصل تغيير خلال الموسم الا اذا صار شيء كارثي
يعني انت لو مكان مشجع ريال مدريد شو بكون موقفك",0,,
NWsNVfHsuF0,سعودي يحلق في السماء وحيدن في السماء والباقي على بعدد شوب ولاك ب  ر,0,,
qej8hvq2lZo,امال برشلونة خسرت من بايرن  نعمل ايه,0,,
u8Y9W0rFGZU,"نعيمي صياحك طرب 
ه 
ه ه",1,1,1
qej8hvq2lZo,اذا احد غدرني من ورا  في ببجي,0,,
qej8hvq2lZo,يا رجال شجع مدريد افضلك,0,,
qej8hvq2lZo,ئاسبحان الله بلامس كنت تضحك على برشلونة بلخسارة  واليوم تخسر ستة واحد من نادي الدجاج,1,1,1
qej8hvq2lZo,بكرا تندم يا جميل,0,,
qej8hvq2lZo,ألقم يا راعي البلنتيات,1,1,1
EF9RniqmCzM,كمافنكا وتشاوميني يقول مانهم فايده ه  وحافي مدري كافي وبدري وفلكس زينين احلا نكته سمعتها جزمه كما فنكا تسوى راسك وراس فريقك,0,,
NWsNVfHsuF0,لو من كاساس اسحب المنتخب وكلهم صارت عدي فاتحه ابغداد,0,,
NWsNVfHsuF0,من الاردن الف الف الف الف مبروك للنسايب الله حيهم,0,,
qej8hvq2lZo,وش تقول علينا ياقلوري انجلدنا ٨ من دفاعنا الزفت بس الله يعدي ذا الموسم على خير,1,1,1
u8Y9W0rFGZU,"عبدالله النعيمي ذكرني بوحده عندنا اسمها فوزيه
طلقها زوجها قبل سنه
وتزوجت من بعده عشان تقهر زوجها بس
عبدالله النعيمي مثلها قد شجع كل الانديه قهر",0,,
qej8hvq2lZo,في المقطع قلت هذا ما يجي شراب فان دايك طلع فان دايك شرابو,0,,
qej8hvq2lZo,اكثر انسان متصنع شفته في حياتي والله,0,,
qej8hvq2lZo,ابلع بس ابلع,1,1,1
u8Y9W0rFGZU,ولا فاهم شي زعيق وصياح احضر مباريات فريقك يا فشلوني,1,1,1
qej8hvq2lZo,مبروك اليكس تيليس,0,,
qej8hvq2lZo,ه والله اول مرة اضحك كما هك,0,,
u8Y9W0rFGZU,"انت شخص مقرف 
عواء كلب مقل كل ردة فعل الك ضد ريال مدريد عندك كره مش طبيعي للريال لو برشلونه يصير معهم نفس سيناريوهات كان بتطير من الفرحة",1,1,1
u8Y9W0rFGZU,منور يارْباله,1,2,1
EF9RniqmCzM,حاقد و تافه,1,1,1
